{
  "id": "ansarada",
  "brand": "Ansarada",
  "source": "user-collected stills from a compilation, rank 1 in overlay",
  "url": null,
  "format": "16:9",
  "duration_s": null,
  "platform": null,
  "style_family": "S1",
  "confidence": "M",
  "rating": null,
  "rating_notes": null,
  "beats": [
    { "n": 1, "role": "pain", "block": "MetaphorImage", "text": null, "notes": "grainy B/W roulette wheel, red tint, close camera" },
    { "n": 2, "role": "turn", "block": "WipeMatchCut", "text": null, "notes": "vertical split; wheel center matches vault door center; dark to white" },
    { "n": 3, "role": "promise", "block": "Promise", "text": "Hello simple and secure data rooms", "notes": "black text on white, left aligned" },
    { "n": 4, "role": "product", "block": "Reveal3D", "text": null, "notes": "white 3D vault door opening onto glowing lime disc" },
    { "n": 5, "role": "product", "block": "DeviceMock", "text": null, "notes": "tilted laptop, skeleton UI with colored status pills" },
    { "n": 6, "role": "product", "block": "DeviceMock", "text": null, "notes": "same UI on phone" },
    { "n": 7, "role": "brand", "block": "LogoCard", "text": null, "notes": "black logo on white" },
    { "n": 8, "role": "proof", "block": "ProofCredential", "text": "First data room to be ISO 27001:2022 certified", "notes": "large black text on white" }
  ],
  "pain_share": 0.15,
  "turn": "split-wipe match-cut on shared circular geometry (dark to light)",
  "motif": "circle (wheel to vault door)",
  "palette_source": "single-accent",
  "palette_notes": "black/dark red then white and light grey; one lime accent after the turn",
  "type_notes": "large neo-grotesque, left aligned, generous space",
  "text_emphasis": ["scale", "contrast of dark vs white worlds"],
  "grain": "heavy",
  "blur_on_motion": null,
  "sentence_split": null,
  "human_presence": "none",
  "ui_fidelity": "skeleton",
  "transitions": ["split-wipe match-cut", "door open reveal"],
  "proof_type": "credential",
  "sound_notes": null,
  "patterns": [1, 2, 3, 4, 5, 6, 7, 13, 21],
  "lessons": [
    "pain can be an image, not words",
    "match-cut on shared geometry makes the turn feel designed",
    "skeleton UI hides complexity",
    "proof is a concrete credential"
  ]
}
