{
  "id": "phantom",
  "brand": "Phantom (wallet)",
  "source": "user-collected stills; overlay says '#8 Google Gemini' but on-screen brand is Phantom (label mismatch to confirm)",
  "url": null,
  "format": "16:9",
  "duration_s": null,
  "platform": null,
  "style_family": "S7",
  "confidence": "M",
  "rating": null,
  "rating_notes": null,
  "beats": [
    { "n": 1, "role": "pain", "block": "OldWay", "text": null, "notes": "three plain grey desktop windows: connect, collections, gas fee table" },
    { "n": 2, "role": "turn", "block": "ClaimWith3D", "text": "a home for your NFTs", "notes": "violet screen, black circle with glassy 3D NFT frame and props" },
    { "n": 3, "role": "product", "block": "GestureCallout", "text": "Pin it!", "notes": "phone long-press menu with bubble and touch ripple" },
    { "n": 4, "role": "promise", "block": "WordBeat", "text": "one wallet", "notes": "black screen, 3D bits orbit" },
    { "n": 5, "role": "product", "block": "Object3D", "text": null, "notes": "3D purple wallet with app cards sliding in and out" },
    { "n": 6, "role": "product", "block": "WordBeat", "text": "drag", "notes": "floating coins, large blobs, black corner" },
    { "n": 7, "role": "promise", "block": "Burst", "text": "a wallet you'll love", "notes": "radial black dashes behind the wallet" },
    { "n": 8, "role": "cta", "block": "UrlCard", "text": "phantom.app", "notes": "white on black" }
  ],
  "pain_share": 0.25,
  "turn": "old grey small windows to big saturated 3D object",
  "motif": "the 3D wallet object",
  "palette_source": "single-accent",
  "palette_notes": "electric violet alternating with pure black; white text",
  "type_notes": "big lowercase geometric sans, white",
  "text_emphasis": ["short lines of 2-4 words", "lowercase"],
  "grain": "none",
  "blur_on_motion": null,
  "sentence_split": null,
  "human_presence": "none",
  "ui_fidelity": "stylized",
  "transitions": ["color flip", "3D tumble", "burst"],
  "proof_type": null,
  "sound_notes": null,
  "patterns": [2, 3, 7, 17, 18, 19, 20, 21],
  "lessons": [
    "old way small and grey, new way big and colored",
    "2 to 4 word lines",
    "gesture callouts",
    "URL end card"
  ]
}
