{
  "id": "slack",
  "brand": "Slack",
  "source": "user-collected stills from a compilation, rank 2 in overlay",
  "url": null,
  "format": "16:9",
  "duration_s": null,
  "platform": null,
  "style_family": "S2",
  "confidence": "M",
  "rating": null,
  "rating_notes": null,
  "beats": [
    { "n": 1, "role": "brand", "block": "LogoCard", "text": null, "notes": "logo with parent-company lockup on white" },
    { "n": 2, "role": "hook", "block": "TypedQuery", "text": "Is Slack changing the way businesses do business?", "notes": "typed in a purple search field, extreme close crop, caret" },
    { "n": 3, "role": "proof", "block": "LogoSwap", "text": "Just ask Roku", "notes": "customer logo replaces a word; blurred footage behind; white type" },
    { "n": 4, "role": "proof", "block": "QuoteCard", "text": "Things move faster because everything is in one place.", "notes": "pink block, key words white, attribution lockup (logo, name, title)" },
    { "n": 5, "role": "proof", "block": "LogoSwap", "text": "And Canva / And Signable", "notes": "roll call over b-roll with logo-in-sentence" },
    { "n": 6, "role": "proof", "block": "QuoteCard", "text": "Slack has been a huge part of how we're building for scale", "notes": "green block; selection box and cursor land on the word scale" },
    { "n": 7, "role": "product", "block": "SpotlightWord", "text": null, "notes": "magnifier reveals white letters on blue" },
    { "n": 8, "role": "product", "block": "CardCollage", "text": null, "notes": "tight crop of colorful UI cards (stats, rocket, table)" },
    { "n": 9, "role": "brand", "block": "ShapeLogo", "text": null, "notes": "logo assembled from large colored shapes" }
  ],
  "pain_share": 0.0,
  "turn": "question to answered-by-customers",
  "motif": "logo-color palette and rounded shapes",
  "palette_source": "per-scene-blocks",
  "palette_notes": "pink, green, blue, yellow, purple blocks (logo colors); dark maroon / dark green text with white payoff words",
  "type_notes": "giant geometric sans, cropped at frame edges; product UI font in the search box",
  "text_emphasis": ["color (white payoff words)", "gesture (selection box, magnifier)"],
  "grain": "none",
  "blur_on_motion": null,
  "sentence_split": null,
  "human_presence": "b-roll",
  "ui_fidelity": "stylized",
  "transitions": ["color-block cuts", "shape assembly"],
  "proof_type": "named customers",
  "sound_notes": null,
  "patterns": [1, 2, 6, 10, 13, 14, 17],
  "lessons": [
    "proof through other people's voices",
    "one color world per scene",
    "key word in white, lead-in dark",
    "brand built from motion shapes"
  ]
}
