{
  "id": "vaylens",
  "brand": "Vaylens",
  "source": "user-collected stills from a compilation, rank 4 in overlay",
  "url": null,
  "format": "16:9",
  "duration_s": null,
  "platform": null,
  "style_family": "S4",
  "confidence": "M",
  "rating": null,
  "rating_notes": null,
  "beats": [
    { "n": 1, "role": "hook", "block": "KaraokeLine", "text": "As the need to use electric cars becomes the norm", "notes": "flat blue; current word bright, others dim" },
    { "n": 2, "role": "pain", "block": "FramedFootage", "text": "the way we [photo] recharge them", "notes": "pale bg; photo in a clean rectangle, text flanks it" },
    { "n": 3, "role": "turn", "block": "ShapePivot", "text": "we built", "notes": "two blue circles close in on the text" },
    { "n": 4, "role": "brand", "block": "ShapeMorph", "text": "vaylens", "notes": "white blob pinches and morphs into the wordmark" },
    { "n": 5, "role": "promise", "block": "CategoryLine", "text": "It's a charging management software", "notes": "purple-blue gradient, light type" },
    { "n": 6, "role": "product", "block": "GlassUI", "text": null, "notes": "frosted glass dashboard over blurred top-down footage of a team" },
    { "n": 7, "role": "proof", "block": "ProofMosaic", "text": "helping thousands of companies", "notes": "mosaic of industry footage on dark panel" }
  ],
  "pain_share": 0.1,
  "turn": "circles close in; 'we built'",
  "motif": "circles and blobs",
  "palette_source": "single-accent",
  "palette_notes": "one electric blue plus pale lavender; purple-blue gradient",
  "type_notes": "light-weight neo-grotesque, generous space",
  "text_emphasis": ["karaoke highlight", "dim to bright"],
  "grain": "light",
  "blur_on_motion": null,
  "sentence_split": 3,
  "human_presence": "b-roll",
  "ui_fidelity": "stylized",
  "transitions": ["shape close-in", "blob morph"],
  "proof_type": "scale",
  "sound_notes": null,
  "patterns": [2, 4, 5, 11, 12, 13, 14],
  "lessons": [
    "open from an agreeable market fact",
    "split one sentence across scenes",
    "shapes as punctuation",
    "plain category line",
    "glass UI over real-world context"
  ]
}
