{
  "id": "monday",
  "brand": "monday.com",
  "source": "user-collected stills from a compilation, rank 5 in overlay",
  "url": null,
  "format": "16:9",
  "duration_s": null,
  "platform": null,
  "style_family": "S5",
  "confidence": "M",
  "rating": null,
  "rating_notes": null,
  "beats": [
    { "n": 1, "role": "hook", "block": "Spokesperson", "text": null, "notes": "man talking to camera in an open-plan office" },
    { "n": 2, "role": "brand", "block": "BrandPill", "text": null, "notes": "logo on a frosted glass pill over a pastel gradient" },
    { "n": 3, "role": "product", "block": "UIZoom", "text": null, "notes": "board UI with colored status and priority cells, avatars" },
    { "n": 4, "role": "product", "block": "UIZoom", "text": null, "notes": "dashboard widgets: progress bar, revenue vs goal, trend line" },
    { "n": 5, "role": "product", "block": "ChatDemo", "text": "Please collect all live Q4 projects into one board / Sure, I'm on it!", "notes": "AI assistant chat" },
    { "n": 6, "role": "product", "block": "CellFill", "text": null, "notes": "board builds itself: circles morph into filled cells, avatars slide in" }
  ],
  "pain_share": 0.0,
  "turn": null,
  "motif": "colored status cells",
  "palette_source": "mixed",
  "palette_notes": "pastel lavender/blue gradient; saturated status colors (green, orange, red, blue, pink) as the signature",
  "type_notes": "clean geometric sans, large board title",
  "text_emphasis": ["color blocks as data"],
  "grain": "none",
  "blur_on_motion": true,
  "sentence_split": null,
  "human_presence": "talking-head",
  "ui_fidelity": "real",
  "transitions": ["blur-in staggered rows", "circle-to-cell morph"],
  "proof_type": null,
  "sound_notes": null,
  "patterns": [4, 12, 13, 14],
  "lessons": [
    "demo-led: UI crops are the content",
    "AI request/response in plain language",
    "shape morph as progress",
    "color-coded cells make the product recognizable"
  ]
}
