{
  "id": "canva",
  "brand": "Canva (video)",
  "source": "user-collected stills from a compilation, rank 6 in overlay",
  "url": null,
  "format": "16:9",
  "duration_s": null,
  "platform": null,
  "style_family": "S6",
  "confidence": "M",
  "rating": null,
  "rating_notes": null,
  "beats": [
    { "n": 1, "role": "hook", "block": "HumanMoment", "text": null, "notes": "woman chopping vegetables, phone held in her mouth to film; script logotype overlay" },
    { "n": 2, "role": "pain", "block": "HumanMoment", "text": null, "notes": "wide shot with ring light" },
    { "n": 3, "role": "bridge", "block": "CursorTag", "text": null, "notes": "overhead hands, purple selection frame, green cursor, name tag" },
    { "n": 4, "role": "product", "block": "PromptUI", "text": "What's the topic of your video? / Sunday slow food energ|", "notes": "white prompt box, four thumbnails from the same footage, option chips" },
    { "n": 5, "role": "brand", "block": "LogoPill", "text": "Canva Video", "notes": "teal-to-violet gradient, white pill" }
  ],
  "pain_share": 0.2,
  "turn": "real footage to product prompt using the same footage",
  "motif": "the footage itself",
  "palette_source": "mixed",
  "palette_notes": "warm real colors in footage; clean white UI with purple accent; teal-violet gradient end card",
  "type_notes": "script logotype on footage; plain sans in UI",
  "text_emphasis": null,
  "grain": "none",
  "blur_on_motion": null,
  "sentence_split": null,
  "human_presence": "story",
  "ui_fidelity": "stylized",
  "transitions": ["footage to UI thumbnails"],
  "proof_type": null,
  "sound_notes": null,
  "patterns": [4, 15, 16],
  "lessons": [
    "story first, product as a simple prompt",
    "footage becomes the UI input",
    "cursor name tag as a character"
  ]
}
