{
  "id": "clickup",
  "brand": "ClickUp",
  "source": "user-collected stills from a compilation, rank 3 in overlay",
  "url": null,
  "format": "16:9",
  "duration_s": null,
  "platform": null,
  "style_family": "S3",
  "confidence": "M",
  "rating": null,
  "rating_notes": null,
  "beats": [
    { "n": 1, "role": "pain", "block": "OverwhelmDiagram", "text": "Work Sprawl is killing us.", "notes": "unreadable diagram of boxes and red arrows behind huge title" },
    { "n": 2, "role": "bridge", "block": "MotifLine", "text": null, "notes": "thick black line with round head, speed streaks" },
    { "n": 3, "role": "pain", "block": "PainFlavor", "text": "Too many apps...", "notes": "app icons tangled on the line with badges and warnings" },
    { "n": 4, "role": "bridge", "block": "Bridge", "text": null, "notes": "dark wedge narrows to the line's head and wipes to white" },
    { "n": 5, "role": "pain", "block": "PainFlavor", "text": "Too many AI tools...", "notes": "dark starry bg, line loops through AI logos" },
    { "n": 6, "role": "pain", "block": "QuestionBubbles", "text": "Context is lost.", "notes": "chat-like bubbles of questions along the line" },
    { "n": 7, "role": "promise", "block": "TextSwap", "text": "Work sprawl kills human productivity / AI productivity", "notes": "grey lead-in, bold black payoff; tilted; swap" },
    { "n": 8, "role": "turn", "block": "Bridge", "text": "It's time to kill sprawl.", "notes": "pale gradient; the line ends as the period" },
    { "n": 9, "role": "other", "block": "StrikeText", "text": "kill Sprawl", "notes": "scanline glitch strike" },
    { "n": 10, "role": "product", "block": "CardGrid", "text": null, "notes": "saturated magenta/orange/purple grained gradient; cards fly with heavy motion blur; grid of mini-apps" },
    { "n": 11, "role": "promise", "block": "Hook", "text": "A New Era of AI", "notes": "soft white star blob on gradient" },
    { "n": 12, "role": "promise", "block": "OrbitCards", "text": "A New Era of Craft & Quality", "notes": "metal-edged cards orbit the text" },
    { "n": 13, "role": "brand", "block": "VersionBadge", "text": "ClickUp 4.0 / AI Workspace", "notes": "logo with version badge; motion-blurred text" },
    { "n": 14, "role": "product", "block": "CardGrid", "text": null, "notes": "tilted isometric UI card wall" }
  ],
  "pain_share": 0.5,
  "turn": "palette flip: monochrome thin line to saturated grained gradient; line ends as the period",
  "motif": "continuous black/white line with round head",
  "palette_source": "mixed",
  "palette_notes": "pain: white/black/pale pink and dark space; solution: magenta-orange-violet gradient with grain",
  "type_notes": "tight-tracked geometric sans; grey lead-in, black or white payoff; tilt for energy",
  "text_emphasis": ["grey to black", "scanline strike", "word swap"],
  "grain": "heavy",
  "blur_on_motion": true,
  "sentence_split": null,
  "human_presence": "none",
  "ui_fidelity": "stylized",
  "transitions": ["wedge wipe", "line sweep", "card fly-through with blur"],
  "proof_type": null,
  "sound_notes": null,
  "patterns": [3, 4, 5, 7, 8, 9, 10, 13, 14, 19, 21],
  "lessons": [
    "one continuous motif ties scenes",
    "pain takes about half the runtime in several flavors",
    "palette flip marks the turn",
    "template reuse with a word swap",
    "text strike for kill"
  ]
}
