{
  "id": "unknown-7",
  "brand": "unidentified (overlay '#7 -' cropped)",
  "source": "one frame only: live-action boardroom, man with white hair and glasses mid-shout, blurred foreground head, cool grey grade",
  "url": null,
  "format": "16:9",
  "duration_s": null,
  "platform": null,
  "style_family": "unknown",
  "confidence": "L",
  "rating": null,
  "rating_notes": "identify the ad and send more frames",
  "beats": [
    { "n": 1, "role": "other", "block": null, "text": null, "notes": "cinematic live action, shallow depth of field, dramatic performance" }
  ],
  "pain_share": null,
  "turn": null,
  "motif": null,
  "palette_source": null,
  "palette_notes": "cool grey blue grade",
  "type_notes": null,
  "text_emphasis": null,
  "grain": null,
  "blur_on_motion": null,
  "sentence_split": null,
  "human_presence": "story",
  "ui_fidelity": null,
  "transitions": null,
  "proof_type": null,
  "sound_notes": null,
  "patterns": [],
  "lessons": []
}
